{
  "$schema": "../schema/puzzle.schema.json",
  "id": "e09-azure",
  "version": 1,
  "scenario": "e09",
  "cloud": "azure",
  "title": "El DNS elige la región y el balanceador elige la VM",
  "summary": "Una tienda vende a México y a España con un solo dominio, tienda.mx, desde Mexico Central y Spain Central. Si cae una región, los compradores deben llegar a la otra en minutos.",
  "topics": [
    "DNS",
    "balanceo",
    "autoescalado",
    "alta disponibilidad multirregión"
  ],
  "source_refs": [
    {
      "title": "Traffic Manager: métodos de enrutamiento",
      "url": "https://learn.microsoft.com/en-us/azure/traffic-manager/traffic-manager-routing-methods"
    },
    {
      "title": "Cómo funciona Azure Traffic Manager",
      "url": "https://learn.microsoft.com/en-us/azure/traffic-manager/traffic-manager-how-it-works"
    },
    {
      "title": "Azure DNS Private Resolver: información general",
      "url": "https://learn.microsoft.com/en-us/azure/dns/dns-private-resolver-overview"
    },
    {
      "title": "¿Qué es Azure Application Gateway?",
      "url": "https://learn.microsoft.com/en-us/azure/application-gateway/overview"
    },
    {
      "title": "Virtual Machine Scale Sets: autoescalado",
      "url": "https://learn.microsoft.com/en-us/azure/virtual-machine-scale-sets/virtual-machine-scale-sets-autoscale-overview"
    },
    {
      "title": "Availability sets: información general",
      "url": "https://learn.microsoft.com/en-us/azure/virtual-machines/availability-set-overview"
    },
    {
      "title": "Azure Monitor: grupos de acciones",
      "url": "https://learn.microsoft.com/en-us/azure/azure-monitor/alerts/action-groups"
    },
    {
      "title": "Azure API Management: información general y conceptos clave",
      "url": "https://learn.microsoft.com/en-us/azure/api-management/api-management-key-concepts"
    },
    {
      "title": "Application Gateway: supervisión de estado",
      "url": "https://learn.microsoft.com/en-us/azure/application-gateway/application-gateway-probe-overview"
    },
    {
      "title": "Log Analytics workspace: información general",
      "url": "https://learn.microsoft.com/en-us/azure/azure-monitor/logs/log-analytics-workspace-overview"
    }
  ],
  "difficulty_override": null,
  "layout": {
    "cols": 9,
    "rows": 7
  },
  "groups": [
    {
      "id": "g-cloud",
      "kind": "azure-subscription",
      "label": "Suscripción de Azure",
      "parent": null,
      "cell": {
        "c": 1.05,
        "r": 0,
        "w": 7.9,
        "h": 5.82
      }
    },
    {
      "id": "g-reg-a",
      "kind": "azure-region",
      "label": "Región A (México)",
      "parent": "g-cloud",
      "cell": {
        "c": 1.11,
        "r": 1.35,
        "w": 3.2,
        "h": 4.41
      }
    },
    {
      "id": "g-net-a",
      "kind": "azure-vnet",
      "label": "VNet 10.0.0.0/16",
      "parent": "g-reg-a",
      "cell": {
        "c": 1.17,
        "r": 1.57,
        "w": 3.08,
        "h": 4.13
      }
    },
    {
      "id": "g-zone-a1",
      "kind": "azure-zone",
      "label": "Zona 1",
      "parent": "g-net-a",
      "cell": {
        "c": 1.23,
        "r": 1.83,
        "w": 1.48,
        "h": 3.81
      }
    },
    {
      "id": "g-zone-a2",
      "kind": "azure-zone",
      "label": "Zona 2",
      "parent": "g-net-a",
      "cell": {
        "c": 2.71,
        "r": 1.83,
        "w": 1.48,
        "h": 3.81
      }
    },
    {
      "id": "g-reg-b",
      "kind": "azure-region",
      "label": "Región B (España)",
      "parent": "g-cloud",
      "cell": {
        "c": 5.69,
        "r": 1.35,
        "w": 3.2,
        "h": 4.41
      }
    },
    {
      "id": "g-net-b",
      "kind": "azure-vnet",
      "label": "VNet 10.1.0.0/16",
      "parent": "g-reg-b",
      "cell": {
        "c": 5.75,
        "r": 1.57,
        "w": 3.08,
        "h": 4.13
      }
    },
    {
      "id": "g-zone-b1",
      "kind": "azure-zone",
      "label": "Zona 1",
      "parent": "g-net-b",
      "cell": {
        "c": 5.81,
        "r": 1.83,
        "w": 1.48,
        "h": 3.81
      }
    },
    {
      "id": "g-zone-b2",
      "kind": "azure-zone",
      "label": "Zona 2",
      "parent": "g-net-b",
      "cell": {
        "c": 7.29,
        "r": 1.83,
        "w": 1.48,
        "h": 3.81
      }
    }
  ],
  "nodes": [
    {
      "id": "n-users",
      "icon": "gen-users",
      "label": "Compradores",
      "number": null,
      "cell": {
        "c": 0,
        "r": 0.3
      },
      "group": null
    },
    {
      "id": "n-vm-a1",
      "icon": "azure-vm",
      "label": "VM web",
      "number": null,
      "cell": {
        "c": 1.47,
        "r": 3.4
      },
      "group": "g-zone-a1"
    },
    {
      "id": "n-vm-a2",
      "icon": "azure-vm",
      "label": "VM web",
      "number": null,
      "cell": {
        "c": 2.95,
        "r": 3.4
      },
      "group": "g-zone-a2"
    },
    {
      "id": "n-vm-b1",
      "icon": "azure-vm",
      "label": "VM web",
      "number": null,
      "cell": {
        "c": 6.05,
        "r": 3.4
      },
      "group": "g-zone-b1"
    },
    {
      "id": "n-vm-b2",
      "icon": "azure-vm",
      "label": "VM web",
      "number": null,
      "cell": {
        "c": 7.53,
        "r": 3.4
      },
      "group": "g-zone-b2"
    },
    {
      "id": "n-team",
      "icon": "gen-team",
      "label": "Equipo de guardia",
      "number": null,
      "cell": {
        "c": 4.5,
        "r": 5.9
      },
      "group": null
    }
  ],
  "slots": [
    {
      "id": "s1",
      "number": 1,
      "cell": {
        "c": 4.5,
        "r": 0.3
      },
      "group": "g-cloud",
      "accept": [
        "azure-traffic-manager"
      ],
      "near_miss": "azure-dns-private-resolver",
      "hint_cue": "responde con la dirección de la región sana más cercana",
      "explanation": "Traffic Manager responde en DNS según su método de enrutamiento: con Performance elige el endpoint de menor latencia y no incluye al que deja de estar disponible. El TTL de sus respuestas se configura, por ejemplo en 60 s.",
      "refs": [
        "https://learn.microsoft.com/en-us/azure/traffic-manager/traffic-manager-routing-methods",
        "https://learn.microsoft.com/en-us/azure/traffic-manager/traffic-manager-how-it-works",
        "https://learn.microsoft.com/en-us/azure/dns/dns-private-resolver-overview"
      ]
    },
    {
      "id": "s2",
      "number": 2,
      "cell": {
        "c": 4.5,
        "r": 2.15
      },
      "group": "g-cloud",
      "accept": [
        "azure-traffic-manager-monitoring"
      ],
      "near_miss": "azure-app-gateway-probe",
      "hint_cue": "prueba desde varios puntos de internet",
      "explanation": "Todo perfil de Traffic Manager incluye monitoreo de endpoints: sus servidores de nombres eligen según la salud que miden esos health checks y dejan de devolver el endpoint que falla. Aquí el monitoreo es una pieza del perfil, no un servicio aparte.",
      "refs": [
        "https://learn.microsoft.com/en-us/azure/traffic-manager/traffic-manager-how-it-works",
        "https://learn.microsoft.com/en-us/azure/traffic-manager/traffic-manager-routing-methods",
        "https://learn.microsoft.com/en-us/azure/application-gateway/overview",
        "https://learn.microsoft.com/en-us/azure/application-gateway/application-gateway-probe-overview"
      ]
    },
    {
      "id": "s3",
      "number": 3,
      "cell": {
        "c": 2.21,
        "r": 2.15
      },
      "group": "g-net-a",
      "accept": [
        "azure-app-gateway"
      ],
      "near_miss": "azure-api-management",
      "hint_cue": "termina TLS y reparte las peticiones",
      "explanation": "Application Gateway v2 es un balanceador de tráfico web de capa 7 que vive en su propia subred de la red virtual: termina SSL/TLS y reparte las peticiones entre los servidores de su pool de backend.",
      "refs": [
        "https://learn.microsoft.com/en-us/azure/application-gateway/overview",
        "https://learn.microsoft.com/en-us/azure/api-management/api-management-key-concepts"
      ]
    },
    {
      "id": "s4",
      "number": 4,
      "cell": {
        "c": 2.21,
        "r": 4.65
      },
      "group": "g-net-a",
      "accept": [
        "azure-vmss"
      ],
      "near_miss": "azure-availability-set",
      "hint_cue": "reemplaza la que falla y agrega más",
      "explanation": "Un Virtual Machine Scale Set sube o baja el número de VM con reglas de métricas como el porcentaje de CPU y admite reparaciones automáticas de instancias. Un availability set reparte VM en dominios de falla; para escalar, la guía recomienda los scale sets.",
      "refs": [
        "https://learn.microsoft.com/en-us/azure/virtual-machine-scale-sets/virtual-machine-scale-sets-autoscale-overview",
        "https://learn.microsoft.com/en-us/azure/virtual-machines/availability-set-overview"
      ]
    },
    {
      "id": "s5",
      "number": 5,
      "cell": {
        "c": 4.5,
        "r": 3.4
      },
      "group": "g-cloud",
      "accept": [
        "azure-action-groups"
      ],
      "near_miss": "azure-log-analytics",
      "hint_cue": "le entrega a guardia el aviso",
      "explanation": "Un grupo de acciones define a quién se avisa cuando se dispara una alerta de Azure Monitor y por qué medio: correo, SMS, llamada de voz o notificación push en la app de Azure.",
      "refs": [
        "https://learn.microsoft.com/en-us/azure/azure-monitor/alerts/action-groups",
        "https://learn.microsoft.com/en-us/azure/azure-monitor/logs/log-analytics-workspace-overview"
      ]
    },
    {
      "id": "s6",
      "number": 6,
      "cell": {
        "c": 6.79,
        "r": 2.15
      },
      "group": "g-net-b",
      "accept": [
        "azure-app-gateway"
      ],
      "near_miss": "azure-api-management",
      "hint_cue": "termina TLS y reparte solo entre las VM web sanas",